{
  "$schema": "https://json-schema.org/draft/2020-12/schema",
  "title": "Future Edition Evidence",
  "type": "object",
  "additionalProperties": false,
  "required": ["id", "claim_id", "source_id", "support", "locator", "observed_at", "valid_from", "valid_to"],
  "properties": {
    "id": {"type": "string", "pattern": "^EVID-[0-9]{6}$"},
    "claim_id": {"type": "string", "pattern": "^CLAIM-[0-9]{6}$"},
    "source_id": {"type": "string", "pattern": "^SRC-[0-9]{6}$"},
    "provenance_id": {"type": ["string", "null"], "pattern": "^PROV-[0-9]{6}$"},
    "support": {"enum": ["supports", "contradicts", "limits", "context"]},
    "locator": {"type": "string", "minLength": 1},
    "excerpt_hash": {"type": ["string", "null"]},
    "notes": {"type": ["string", "null"]},
    "observed_at": {"type": "string", "format": "date-time"},
    "valid_from": {"type": ["string", "null"], "format": "date-time"},
    "valid_to": {"type": ["string", "null"], "format": "date-time"}
  }
}
