[
  {
    "id": "EVID-050001",
    "claim_id": "CLAIM-050001",
    "source_id": "SRC-050001",
    "provenance_id": "PROV-050001",
    "support": "supports",
    "locator": "Product details — Original Approval Date",
    "excerpt_hash": null,
    "notes": "Foundational baseline evidence; does not by itself assign a milestone state.",
    "observed_at": "2026-09-20T14:45:00Z",
    "valid_from": "1998-09-25T00:00:00Z",
    "valid_to": null
  },
  {
    "id": "EVID-050002",
    "claim_id": "CLAIM-050002",
    "source_id": "SRC-050002",
    "provenance_id": "PROV-050002",
    "support": "supports",
    "locator": "Marketing approved — May 10, 2001",
    "excerpt_hash": null,
    "notes": "Foundational baseline evidence; does not by itself assign a milestone state.",
    "observed_at": "2026-09-20T14:45:00Z",
    "valid_from": "2001-05-10T00:00:00Z",
    "valid_to": null
  },
  {
    "id": "EVID-050003",
    "claim_id": "CLAIM-050003",
    "source_id": "SRC-050003",
    "provenance_id": "PROV-050003",
    "support": "supports",
    "locator": "Product details — Original Approval Date",
    "excerpt_hash": null,
    "notes": "Foundational baseline evidence; does not by itself assign a milestone state.",
    "observed_at": "2026-09-20T14:45:00Z",
    "valid_from": "2010-04-29T00:00:00Z",
    "valid_to": null
  },
  {
    "id": "EVID-050004",
    "claim_id": "CLAIM-050004",
    "source_id": "SRC-050004",
    "provenance_id": "PROV-050004",
    "support": "supports",
    "locator": "Supporting documents — August 30, 2017 approval",
    "excerpt_hash": null,
    "notes": "Foundational baseline evidence; does not by itself assign a milestone state.",
    "observed_at": "2026-09-20T14:45:00Z",
    "valid_from": "2017-08-30T00:00:00Z",
    "valid_to": null
  },
  {
    "id": "EVID-050005",
    "claim_id": "CLAIM-050005",
    "source_id": "SRC-050005",
    "provenance_id": "PROV-050005",
    "support": "supports",
    "locator": "Approval summary and KEYNOTE-177 efficacy section",
    "excerpt_hash": null,
    "notes": "Foundational baseline evidence; does not by itself assign a milestone state.",
    "observed_at": "2026-09-20T14:45:00Z",
    "valid_from": "2020-06-29T00:00:00Z",
    "valid_to": null
  },
  {
    "id": "EVID-050006",
    "claim_id": "CLAIM-050006",
    "source_id": "SRC-050006",
    "provenance_id": "PROV-050006",
    "support": "supports",
    "locator": "Abstract",
    "excerpt_hash": null,
    "notes": "Foundational baseline evidence; does not by itself assign a milestone state.",
    "observed_at": "2026-09-20T14:45:00Z",
    "valid_from": "2009-07-08T00:00:00Z",
    "valid_to": null
  },
  {
    "id": "EVID-050007",
    "claim_id": "CLAIM-050007",
    "source_id": "SRC-050007",
    "provenance_id": "PROV-050007",
    "support": "supports",
    "locator": "Abstract",
    "excerpt_hash": null,
    "notes": "Foundational baseline evidence; does not by itself assign a milestone state.",
    "observed_at": "2026-09-20T14:45:00Z",
    "valid_from": "2011-11-02T00:00:00Z",
    "valid_to": null
  },
  {
    "id": "EVID-050008",
    "claim_id": "CLAIM-050008",
    "source_id": "SRC-050008",
    "provenance_id": "PROV-050008",
    "support": "supports",
    "locator": "Abstract",
    "excerpt_hash": null,
    "notes": "Foundational baseline evidence; does not by itself assign a milestone state.",
    "observed_at": "2026-09-20T14:45:00Z",
    "valid_from": "2016-02-03T00:00:00Z",
    "valid_to": null
  },
  {
    "id": "EVID-050009",
    "claim_id": "CLAIM-050009",
    "source_id": "SRC-050009",
    "provenance_id": "PROV-050009",
    "support": "supports",
    "locator": "Abstract",
    "excerpt_hash": null,
    "notes": "Foundational baseline evidence; does not by itself assign a milestone state.",
    "observed_at": "2026-09-20T14:45:00Z",
    "valid_from": "2018-03-22T00:00:00Z",
    "valid_to": null
  },
  {
    "id": "EVID-050010",
    "claim_id": "CLAIM-050010",
    "source_id": "SRC-050010",
    "provenance_id": "PROV-050010",
    "support": "supports",
    "locator": "Abstract and results",
    "excerpt_hash": null,
    "notes": "Foundational baseline evidence; does not by itself assign a milestone state.",
    "observed_at": "2026-09-20T14:45:00Z",
    "valid_from": "2023-02-09T00:00:00Z",
    "valid_to": null
  },
  {
    "id": "EVID-050011",
    "claim_id": "CLAIM-050011",
    "source_id": "SRC-050011",
    "provenance_id": "PROV-050011",
    "support": "supports",
    "locator": "Abstract",
    "excerpt_hash": null,
    "notes": "Foundational baseline evidence; does not by itself assign a milestone state.",
    "observed_at": "2026-09-20T14:45:00Z",
    "valid_from": "2011-06-04T00:00:00Z",
    "valid_to": null
  },
  {
    "id": "EVID-050012",
    "claim_id": "CLAIM-050012",
    "source_id": "SRC-050012",
    "provenance_id": "PROV-050012",
    "support": "supports",
    "locator": "Abstract",
    "excerpt_hash": null,
    "notes": "Foundational baseline evidence; does not by itself assign a milestone state.",
    "observed_at": "2026-09-20T14:45:00Z",
    "valid_from": "2018-10-31T00:00:00Z",
    "valid_to": null
  },
  {
    "id": "EVID-050013",
    "claim_id": "CLAIM-050013",
    "source_id": "SRC-050013",
    "provenance_id": "PROV-050013",
    "support": "supports",
    "locator": "Abstract",
    "excerpt_hash": null,
    "notes": "Foundational baseline evidence; does not by itself assign a milestone state.",
    "observed_at": "2026-09-20T14:45:00Z",
    "valid_from": "2019-10-03T00:00:00Z",
    "valid_to": null
  },
  {
    "id": "EVID-050014",
    "claim_id": "CLAIM-050014",
    "source_id": "SRC-050014",
    "provenance_id": "PROV-050014",
    "support": "supports",
    "locator": "Abstract",
    "excerpt_hash": null,
    "notes": "Foundational baseline evidence; does not by itself assign a milestone state.",
    "observed_at": "2026-09-20T14:45:00Z",
    "valid_from": "2022-02-07T00:00:00Z",
    "valid_to": null
  },
  {
    "id": "EVID-050015",
    "claim_id": "CLAIM-050015",
    "source_id": "SRC-050015",
    "provenance_id": "PROV-050015",
    "support": "supports",
    "locator": "Abstract",
    "excerpt_hash": null,
    "notes": "Foundational baseline evidence; does not by itself assign a milestone state.",
    "observed_at": "2026-09-20T14:45:00Z",
    "valid_from": "2023-05-24T00:00:00Z",
    "valid_to": null
  },
  {
    "id": "EVID-050016",
    "claim_id": "CLAIM-050016",
    "source_id": "SRC-050016",
    "provenance_id": "PROV-050016",
    "support": "supports",
    "locator": "HDE approval record — Decision Date",
    "excerpt_hash": null,
    "notes": "Foundational baseline evidence; does not by itself assign a milestone state.",
    "observed_at": "2026-09-20T14:45:00Z",
    "valid_from": "2013-02-13T00:00:00Z",
    "valid_to": null
  },
  {
    "id": "EVID-050017",
    "claim_id": "CLAIM-050017",
    "source_id": "SRC-050017",
    "provenance_id": "PROV-050017",
    "support": "supports",
    "locator": "Abstract",
    "excerpt_hash": null,
    "notes": "Foundational baseline evidence; does not by itself assign a milestone state.",
    "observed_at": "2026-09-20T14:45:00Z",
    "valid_from": "2014-10-15T00:00:00Z",
    "valid_to": null
  },
  {
    "id": "EVID-050018",
    "claim_id": "CLAIM-050018",
    "source_id": "SRC-050018",
    "provenance_id": "PROV-050018",
    "support": "supports",
    "locator": "Abstract and primary outcome",
    "excerpt_hash": null,
    "notes": "Foundational baseline evidence; does not by itself assign a milestone state.",
    "observed_at": "2026-09-20T14:45:00Z",
    "valid_from": "2017-07-14T00:00:00Z",
    "valid_to": null
  },
  {
    "id": "EVID-050019",
    "claim_id": "CLAIM-050019",
    "source_id": "SRC-050019",
    "provenance_id": "PROV-050019",
    "support": "supports",
    "locator": "Supporting documents — December 19, 2017 approval",
    "excerpt_hash": null,
    "notes": "Foundational baseline evidence; does not by itself assign a milestone state.",
    "observed_at": "2026-09-20T14:45:00Z",
    "valid_from": "2017-12-19T00:00:00Z",
    "valid_to": null
  },
  {
    "id": "EVID-050020",
    "claim_id": "CLAIM-050020",
    "source_id": "SRC-050020",
    "provenance_id": "PROV-050020",
    "support": "supports",
    "locator": "Abstract",
    "excerpt_hash": null,
    "notes": "Foundational baseline evidence; does not by itself assign a milestone state.",
    "observed_at": "2026-09-20T14:45:00Z",
    "valid_from": "2021-05-24T00:00:00Z",
    "valid_to": null
  },
  {
    "id": "EVID-050021",
    "claim_id": "CLAIM-050021",
    "source_id": "SRC-050021",
    "provenance_id": "PROV-050021",
    "support": "supports",
    "locator": "Abstract",
    "excerpt_hash": null,
    "notes": "Foundational baseline evidence; does not by itself assign a milestone state.",
    "observed_at": "2026-09-20T14:45:00Z",
    "valid_from": "2022-12-13T00:00:00Z",
    "valid_to": null
  },
  {
    "id": "EVID-050022",
    "claim_id": "CLAIM-050022",
    "source_id": "SRC-050022",
    "provenance_id": "PROV-050022",
    "support": "supports",
    "locator": "Abstract",
    "excerpt_hash": null,
    "notes": "Foundational baseline evidence; does not by itself assign a milestone state.",
    "observed_at": "2026-09-20T14:45:00Z",
    "valid_from": "2023-03-06T00:00:00Z",
    "valid_to": null
  },
  {
    "id": "EVID-050023",
    "claim_id": "CLAIM-050023",
    "source_id": "SRC-050023",
    "provenance_id": "PROV-050023",
    "support": "supports",
    "locator": "Abstract and evaluation summary",
    "excerpt_hash": null,
    "notes": "Foundational baseline evidence; does not by itself assign a milestone state.",
    "observed_at": "2026-09-20T14:45:00Z",
    "valid_from": "2023-07-28T00:00:00Z",
    "valid_to": null
  },
  {
    "id": "EVID-050024",
    "claim_id": "CLAIM-050024",
    "source_id": "SRC-050024",
    "provenance_id": "PROV-050024",
    "support": "supports",
    "locator": "Abstract",
    "excerpt_hash": null,